{
  "schemaVersion": "phase9.resume-snapshot.v1",
  "writtenAt": "2026-04-23T11:30:00Z",
  "writtenReason": "pre-handoff",
  "objectiveId": "OBJ-2026-04-22-001",
  "objectiveStatusAtSnapshot": "active",
  "runtimeMode": "unattended-batch",
  "reasoningMode": "rule-only",
  "wakePolicySnapshot": {
    "wakeOwner": "windows-task-scheduler",
    "wakeSourceId": "TASK-OBJ-2026-04-22-001",
    "heartbeatIntervalSeconds": 1800,
    "leaseTtlSeconds": 900,
    "duplicateWakePolicy": "no-op"
  },
  "budgetRemaining": {
    "maxWallSecondsLeft": 14200,
    "maxIterationsLeft": 10,
    "costCeilingLeft": 17.00
  },
  "queueVisibility": {
    "queuePath": ".vibe-science-environment/objectives/OBJ-2026-04-22-001/queue.json",
    "queueCursor": "cursor-3",
    "pendingCount": 0,
    "runningCount": 0,
    "lastTaskId": "TASK-003"
  },
  "stageCursor": {
    "current": "analysis",
    "stageStatus": "active",
    "lastCompleteStage": "orientation"
  },
  "nextAction": {
    "kind": "enqueue-task",
    "params": {
      "stageId": "analysis",
      "blockedByHandoffId": "H-0008"
    }
  },
  "openBlockers": [],
  "openHandoffs": [
    "H-0007",
    "H-0008"
  ],
  "wakeLease": {
    "wakeId": "WAKE-2026-04-23-001",
    "leaseAcquiredAt": "2026-04-23T11:25:00Z",
    "leaseExpiresAt": "2026-04-23T11:40:00Z",
    "acquiredBy": "scheduler",
    "previousWakeId": "WAKE-2026-04-22-001"
  },
  "kernelFingerprint": {
    "lastClaimId": "CLM-002",
    "lastCitationCheckId": "CIT-005",
    "lastR2VerdictId": "R2-001",
    "lastObserverAlertId": null,
    "lastGateCheckId": "GATE-003",
    "lastPatternId": null,
    "takenAt": "2026-04-23T11:29:45Z"
  },
  "notes": "Pre-handoff checkpoint before opening H-0008 cross-role consultation."
}
