{
  "schemaVersion": "phase9.resume-snapshot.v1",
  "writtenAt": "2026-04-23T03:30:00Z",
  "writtenReason": "pre-stop",
  "objectiveId": "OBJ-2026-04-22-001",
  "objectiveStatusAtSnapshot": "blocked",
  "runtimeMode": "unattended-batch",
  "reasoningMode": "rule-only",
  "wakePolicySnapshot": {
    "wakeOwner": "windows-task-scheduler",
    "wakeSourceId": "TASK-OBJ-2026-04-22-001",
    "heartbeatIntervalSeconds": 1800,
    "leaseTtlSeconds": 900,
    "duplicateWakePolicy": "no-op"
  },
  "budgetRemaining": {
    "maxWallSecondsLeft": 1200,
    "maxIterationsLeft": 1,
    "costCeilingLeft": 3.5
  },
  "queueVisibility": {
    "queuePath": ".vibe-science-environment/objectives/OBJ-2026-04-22-001/queue.json",
    "queueCursor": null,
    "pendingCount": 0,
    "runningCount": 0,
    "lastTaskId": "TASK-009"
  },
  "stageCursor": {
    "current": "analysis",
    "stageStatus": "blocked",
    "lastCompleteStage": "orientation"
  },
  "nextAction": {
    "kind": "await-operator",
    "params": {
      "blockerCode": "E_LLM_REASONING_REQUIRED"
    }
  },
  "openBlockers": [
    {
      "code": "E_LLM_REASONING_REQUIRED",
      "message": "No further sanctioned slice is mechanically derivable.",
      "openedAt": "2026-04-23T03:29:00Z"
    }
  ],
  "openHandoffs": [],
  "wakeLease": {
    "wakeId": "WAKE-2026-04-23-004",
    "leaseAcquiredAt": "2026-04-23T03:28:00Z",
    "leaseExpiresAt": "2026-04-23T03:43:00Z",
    "acquiredBy": "scheduler",
    "previousWakeId": "WAKE-2026-04-23-003"
  },
  "kernelFingerprint": {
    "lastClaimId": "CLM-002",
    "lastCitationCheckId": "CIT-010",
    "lastR2VerdictId": "R2-004",
    "lastObserverAlertId": null,
    "lastGateCheckId": "GATE-010",
    "lastPatternId": null,
    "takenAt": "2026-04-23T03:27:00Z"
  },
  "notes": "Blocking before stop; operator intervention required."
}
